{
  "spec_version": "1.0",
  "event_type": "maintenance.work_order_intent",
  "event_id": "e2f3a4b5-c6d7-8e9f-0a1b-2c3d4e5f6a7b",
  "correlation_id": "3b2f9d8c-1c33-4a8a-9b77-54d11b2efc12",
  "source_event_id": "a9e3c4b2-9d3a-4a12-b1f3-2e44a1caa8a1",
  "timestamp": "2026-03-06T17:50:18Z",
  "source": "acme.cmms",
  "content_hash": "9d2e5a8f3c1b7e4a",
  "asset": {
    "asset_id": "MOTOR-001",
    "asset_name": "Motor Bomba P-101",
    "plant": "Planta Norte",
    "area": "Turbinas"
  },
  "data": {
    "title": "Bearing failure predicted — Motor Bomba P-101",
    "description": "Inner race defect detected by AI vibration diagnosis. Health index 0.16, RUL 5 days. Immediate bearing replacement recommended.",
    "priority": "emergency",
    "recommended_due_days": 3,
    "triggered_by": "ai_diagnosis"
  }
}